Title,URL,Description,Start_date,Deadline
Mathematical sciences open and open plus fellowship,https://www.ukri.org/opportunity/mathematical-sciences-open-and-open-plus-fellowship/,"These are personal, career development focused awards for the mathematical sciences.",30 January 2025 9:00am UK time,Date de clôture non spécifiée
AHRC responsive mode: UKRI NSF-SBE lead agency,https://www.ukri.org/opportunity/ahrc-responsive-mode-ukri-nsf-sbe-lead-agency/,Apply for funding to work with overseas researchers in the Unites States (US).,11 December 2024 9:00am UK time,Date de clôture non spécifiée
AHRC responsive mode: working with Brazilian researchers,https://www.ukri.org/opportunity/ahrc-responsive-mode-working-with-brazilian-researchers/,"Apply for funding to work with overseas researchers in the State of São Paulo, Brazil.",11 December 2024 9:00am UK time,Date de clôture non spécifiée
AHRC responsive mode: collaborate with researchers in Luxembourg,https://www.ukri.org/opportunity/ahrc-responsive-mode-collaborate-with-researchers-in-luxembourg/,Apply for funding to work with overseas researchers in Luxembourg.,11 December 2024 9:00am UK time,Date de clôture non spécifiée
AHRC responsive mode: standard research grant,https://www.ukri.org/opportunity/ahrc-responsive-mode-standard-research-grant/,"Apply for Arts and Humanities Research Council (AHRC) standard research grant funding to support well-defined collaborative projects across the arts and humanities, in areas covered by our remit.",11 December 2024 9:00am UK time,Date de clôture non spécifiée
EPSRC programme grant outline stage,https://www.ukri.org/opportunity/epsrc-programme-grant-outline-stage/,Programme grants provide flexible funding to world-leading UK research groups addressing significant research challenges.,1 October 2024 9:00am UK time,Date de clôture non spécifiée
International Travel Award Scheme for the Biological Sciences,https://www.ukri.org/opportunity/bbsrc-international-travel-award-scheme/,"Apply for funding to visit international partners, in order to initiate collaborations, prepare joint funding proposals, visit overseas facilities or attend European consortia-building events. Stays may be of up to one month in duration.",1 October 2024 9:00am UK time,30 September 2025 4:00pm UK time
Projects Peer Review Panel (PPRP) 2025,https://www.ukri.org/opportunity/projects-peer-review-panel-pprp-2025/,Apply for funding to develop a large or complex scientific project. You must have already discussed your ideas with one of our programme managers and have been invited to submit a full proposal.,1 October 2024 9:00am UK time,28 August 2025 4:00pm UK time
NERC urgency funding,https://www.ukri.org/opportunity/nerc-urgency-funding-open/,"Apply for funding to respond quickly to transient, unexpected environmental research opportunities created by sporadic natural occurrences such as earthquakes, droughts, floods, or ephemeral events in ecosystems.",8 July 2024 9:00am UK time,Date de clôture non spécifiée
Strategic infrastructure outlines,https://www.ukri.org/opportunity/strategic-infrastructure-outlines/,"Apply for funding to purchase strategic infrastructure including equipment, resources or both.",18 June 2024 9:00am UK time,Date de clôture non spécifiée
Work with US-based researchers on environmental science: NERC-NSF lead agency,https://www.ukri.org/opportunity/work-with-us-based-researchers-on-environmental-science-research/,Apply for funding to work with US-based researchers on an environmental science application.,Date d'ouverture non spécifiée,Date de clôture non spécifiée
Collaborate with the functional genomics screening laboratory,https://www.ukri.org/opportunity/collaborate-with-the-functional-genomics-screening-laboratory/,Apply to collaborate with the functional genomics screening laboratory on projects using complex human in vitro models for CRISPR screening to better understand model biology.,Date d'ouverture non spécifiée,Date de clôture non spécifiée
Open access fund for longform publications: stage two,https://www.ukri.org/opportunity/open-access-fund-for-longform-publications-stage-two/,Research organisations can claim open access costs for longform publications in-scope of UK Research and Innovation (UKRI)’s open access policy that have been approved at stage one.,15 January 2024 9:00am UK time,Date de clôture non spécifiée
Mathematical sciences small grants,https://www.ukri.org/opportunity/mathematical-sciences-small-grants/,Applications to the Mathematical Sciences Small Grants funding opportunity must focus on original research projects.,2 January 2024 9:00am UK time,Date de clôture non spécifiée
EPSRC network grant: Nov 2023: responsive mode,https://www.ukri.org/opportunity/epsrc-network-grant-nov-2023-responsive-mode/,You can apply for a network grant in any area within the remit of Engineering and Physical Sciences Research Council (EPSRC).,13 November 2023 9:00am UK time,Date de clôture non spécifiée
EPSRC working with overseas scientists: Nov 2023: responsive mode (invite only),https://www.ukri.org/opportunity/epsrc-working-with-overseas-scientists-nov-2023-responsive-mode/,"This is an opportunity for you to work with researchers in Ireland, Luxembourg, Brazil, and the US through EPSRC’s lead agency agreements.",13 November 2023 9:00am UK time,Date de clôture non spécifiée
EPSRC new investigator award: Nov 2023: responsive mode,https://www.ukri.org/opportunity/epsrc-new-investigator-award-nov-2023-responsive-mode/,This funding opportunity is for people who are establishing their own independent research vision.,13 November 2023 9:00am UK time,Date de clôture non spécifiée
"EPSRC discipline hopping in ICT, Nov 2023: responsive mode",https://www.ukri.org/opportunity/epsrc-discipline-hopping-in-ict-nov-2023-responsive-mode/,"This is an opportunity for information and communications technology (ICT) researchers to use their expertise in other disciplines, or for other researchers to apply their expertise to ICT.",13 November 2023 9:00am UK time,Date de clôture non spécifiée
EPSRC overseas travel grant: Nov 2023: responsive mode,https://www.ukri.org/opportunity/epsrc-overseas-travel-grant-nov-2023-responsive-mode/,You can apply for an overseas travel grant in any area within the remit of EPSRC.,13 November 2023 9:00am UK time,Date de clôture non spécifiée
"EPSRC standard research grant, Nov 2023: responsive mode",https://www.ukri.org/opportunity/epsrc-standard-research-grant-nov-2023-responsive-mode/,You can apply for a research grant in any area within the remit of Engineering and Physical Sciences Research Council (EPSRC).,13 November 2023 9:00am UK time,Date de clôture non spécifiée
ESRC responsive mode: research grants round two,https://www.ukri.org/opportunity/esrc-responsive-mode-research-grants-round-two/,"This opportunity funds researcher-driven basic, applied, and strategic research from any disciplines and on any topics in ESRC’s remit, as long as the social sciences are more than 50% of the focus and effort.",29 September 2023 9:00am UK time,Date de clôture non spécifiée
ESRC responsive mode: new investigator grants round two,https://www.ukri.org/opportunity/esrc-responsive-mode-new-investigator-grants-round-two/,This opportunity funds new researchers at the start of their careers to support them to become independent researchers through gaining experience of managing and leading research projects and teams.,29 September 2023 9:00am UK time,Date de clôture non spécifiée
ESRC responsive mode: working with Luxembourg researchers round two,https://www.ukri.org/opportunity/esrc-responsive-mode-working-with-luxembourg-researchers-round-two/,"This opportunity funds collaborative work with researchers in Luxembourg, governed by an agreement between UK Research and Innovation (UKRI) and FNR in Luxembourg.",29 September 2023 9:00am UK time,Date de clôture non spécifiée
ESRC responsive mode: secondary data analysis round two,https://www.ukri.org/opportunity/esrc-responsive-mode-secondary-data-analysis-round-two/,"Individuals and research teams can apply for funding to support high-impact, policy- and practitioner-relevant research through deeper exploitation of existing data resources from any disciplines and on any topics in ESRC’s remit.",29 September 2023 9:00am UK time,Date de clôture non spécifiée
ESRC responsive mode: UKRI-SBE lead agency opportunity round two,https://www.ukri.org/opportunity/esrc-responsive-mode-ukri-sbe-lead-agency-opportunity-round-two/,The UKRI-SBE lead agency funding opportunity allows UK and US-based researchers to submit a collaborative proposal that will go through a single review process. Grants are funded through existing funding programmes at the relevant lead agency.,29 September 2023 9:00am UK time,Date de clôture non spécifiée
ESRC responsive mode: working with Brazilian researchers round two,https://www.ukri.org/opportunity/esrc-responsive-mode-working-with-brazilian-researchers-round-two/,"If you are a UK-based researcher you can apply for funding to work with overseas researchers in the State of São Paulo, Brazil. Submit collaborative research proposals in any area of the social sciences within the remit of both ESRC and FAPESP.",29 September 2023 9:00am UK time,Date de clôture non spécifiée
Collaborate with researchers in Luxembourg,https://www.ukri.org/opportunity/collaborate-with-researchers-in-luxembourg/,UKRI and FNR have signed a memorandum of understanding to enable and support applications between researchers in the UK and Luxembourg. UKRI will fund the UK component and FNR will fund the Luxembourg component of the application.,Date d'ouverture non spécifiée,Date de clôture non spécifiée
Researching motor neurone disease: highlight notice,https://www.ukri.org/opportunity/researching-motor-neurone-disease-highlight-notice/,Apply for funding to research motor neurone disease (MND).,1 December 2022,Date de clôture non spécifiée
Work with Brazilian researchers: NERC FAPESP lead agency,https://www.ukri.org/opportunity/work-with-brazilian-researchers-nerc-fapesp-lead-agency/,"This opportunity allows UK-based researchers and researchers in the State of São Paulo, Brazil to submit a collaborative application under existing NERC funding opportunities. This will go through a single review process.",Date d'ouverture non spécifiée,Date de clôture non spécifiée
PATT travel claim for competitively awarded observation time,https://www.ukri.org/opportunity/patt-travel-claim-for-competitively-awarded-observation-time/,Claim back travel and subsistence costs when visiting an astronomy telescope. The visit must be for competitively awarded science observation time.,1 January 2021,Date de clôture non spécifiée
Collaborate with researchers in Brazil,https://www.ukri.org/opportunity/collaborate-with-researchers-in-brazil/,UK Research and Innovation (UKRI) and FAPESP’s lead agency agreement allows UKRI to assess joint applications from eligible UK and Brazil-based researchers from the state of São Paulo on behalf of both organisations.,Date d'ouverture non spécifiée,Date de clôture non spécifiée
UKRI-SBE lead agency opportunity,https://www.ukri.org/opportunity/ukri-sbe-lead-agency-opportunity/,The UKRI-SBE lead agency opportunity allows UK and US-based researchers to submit a collaborative proposal that will go through a single review process. Grants are funded through existing funding programmes at the relevant lead agency.,Date d'ouverture non spécifiée,Date de clôture non spécifiée
Institutional strategic developmental projects in higher education,https://www.ukri.org/opportunity/research-england-development-fund/,Apply for funding to develop institutional-level innovations in research and knowledge exchange.,Date d'ouverture non spécifiée,Date de clôture non spécifiée
Daphne Jackson fellowship,https://www.ukri.org/opportunity/daphne-jackson-fellowship/,"These fellowships are for those looking to return to a research career after a break. Fellowships combine a personalised retraining programme with a challenging research project. They are flexible, usually lasting two years at 0.5 full-time equivalent, although some UKRI funders may award longer.",Date d'ouverture non spécifiée,Date de clôture non spécifiée
Return to research support bursary,https://www.ukri.org/opportunity/return-to-research-support-bursary/,You can apply for this bursary if you are a researcher looking to return to an academic research career after a break of two or more years.,Date d'ouverture non spécifiée,Date de clôture non spécifiée
